{
  "schemaVersion": 1,
  "claimId": "CLM-P034-001",
  "phaseId": "P034",
  "taskId": "T034.1",
  "claimEpoch": 1,
  "state": "ACCEPTED",
  "owner": {
    "agentId": "gpt-6"
  },
  "baseMainSha": "1ea1c08286c976ebd3bbc6aaa32169f18e74a603",
  "branch": "agent/gpt-6/p034-t034-1",
  "writePaths": [
    "extension/pcms/app/views/accounts/**",
    "extension/pcms/app/ui/picker/**",
    "pcms-modules/p014/**",
    "tests/pcms/p034/**",
    "docs/evidence/P034/**",
    "docs/implementation/v1/claims/CLM-P034-001.json",
    "extension/pcms/app/app.js",
    "extension/pcms/app/index.html",
    "extension/pcms/app/app.css",
    "extension/pcms/integration/composition.js",
    "package.json",
    ".github/workflows/firefox.yml"
  ],
  "contractReads": [],
  "contractWrites": [],
  "resources": [
    {
      "key": "ci-workflows",
      "mode": "exclusive"
    }
  ],
  "migrationSlots": [],
  "acceptanceIds": [
    "A034-01",
    "A034-02",
    "A034-03"
  ]
}
